{"authority":{"published_specification":false,"snapshot_id":"WEXP-SYNTH-SNAPSHOT-B","snapshot_path":"src/wexp_ref/core01/seeds/synthetic-b.json","xml_bytes":1,"xml_sha256":"000000000000000000000000000000000000000000000000000000000000000b"},"bound_files":[{"bytes":2725,"kind":"test-vector","path":"vectors/WEXP-SYNTH-B-TV-0001.json","sha256":"1dd67f10682a38db9c294fe8a215c9936f4271c62f873fa88497d0fe7e71f9e1"},{"bytes":2503,"kind":"test-vector","path":"vectors/WEXP-SYNTH-B-TV-0002.json","sha256":"ea9c3de26f6ef8548e722a4d6dc36b06b89128942fef288e1aff3b919227231a"},{"bytes":2500,"kind":"test-vector","path":"vectors/WEXP-SYNTH-B-TV-0003.json","sha256":"be0c58e3d719d551f9e685a3e9dffaa871c7d176e70f96c831f3fa955747027c"},{"bytes":2836,"kind":"test-vector","path":"vectors/WEXP-SYNTH-B-TV-0004.json","sha256":"cf05ff224594a396f4cec1dfc8adb517ff731a1f2ed073fec24bd24605ba3bcc"},{"bytes":3122,"kind":"test-vector","path":"vectors/WEXP-SYNTH-B-TV-0005.json","sha256":"5f58b6467ef8ad3a895673670477d2e3cb4c7aa360cc15bf30c7991b16f50642"},{"bytes":3073,"kind":"test-vector","path":"vectors/WEXP-SYNTH-B-TV-0006.json","sha256":"afb261a7b30f2f9881a63cfc583729ceb73e44a70ce7b6f7c266e047abea1958"},{"bytes":2116,"kind":"test-vector","path":"vectors/WEXP-SYNTH-B-TV-0007.json","sha256":"24510129e698703e8986ff4133b9bb1e1466fabdd24c4282d9dca553f463295f"}],"candidate_id":"WEXP-SYNTH-CANDIDATE-B","counts":{"requirements":7,"vectors":7},"descriptor_version":1,"non_claims":["Synthetic migration fixture. Not a Publication Candidate, not a freeze, not a ceremony.","Carries no relationship to any real WEXP snapshot or published specification.","The authority block is a placeholder: published_specification is false, so these fixtures assert no published specification and carry no publication authority. snapshot_path names this seed itself, not a specification artifact."],"profile":{"path":"profile.json","sha256":"e6fc829bf1145dc69e944af8ca9991c8226ded24787e446a4179be0d42db1791"},"release_status":"not-a-publication-candidate","status":"SYNTHETIC-SUCCESSOR-FIXTURE"}
