{"authority":{"published_specification":false,"snapshot_id":"WEXP-SYNTH-SNAPSHOT-A","snapshot_path":"src/wexp_ref/core01/seeds/synthetic-a.json","xml_bytes":1,"xml_sha256":"000000000000000000000000000000000000000000000000000000000000000a"},"bound_files":[{"bytes":2722,"kind":"test-vector","path":"vectors/WEXP-SYNTH-A-TV-0001.json","sha256":"4bcaeac424679782e20b249cd9de232d1583708c6cf960449dcb5a2041cda1f2"},{"bytes":2505,"kind":"test-vector","path":"vectors/WEXP-SYNTH-A-TV-0002.json","sha256":"79f3a287b29da9c1a4d3f6972ecc6f46d41725bec3694f6c089bff2f30fddaeb"},{"bytes":2507,"kind":"test-vector","path":"vectors/WEXP-SYNTH-A-TV-0003.json","sha256":"f49e9772aedc457d78f49b27ec63d44a30a08a8008d98194d8d793f2b7f47b23"},{"bytes":2848,"kind":"test-vector","path":"vectors/WEXP-SYNTH-A-TV-0004.json","sha256":"5ac0f2fefe8df329c1e05d51e58988d05f9f130623eace3d26c5e98cee620d4e"},{"bytes":3119,"kind":"test-vector","path":"vectors/WEXP-SYNTH-A-TV-0005.json","sha256":"38adaf94cb5c2d60fd9b570aac44e0d450382f09d6e85f22b097b458ea42bc3b"},{"bytes":3061,"kind":"test-vector","path":"vectors/WEXP-SYNTH-A-TV-0006.json","sha256":"e2ee7a6ed7dbaf94b9b82e25011df10a9b6305ed4cd10e293bc84f2ca7933b52"},{"bytes":2131,"kind":"test-vector","path":"vectors/WEXP-SYNTH-A-TV-0007.json","sha256":"780db8ba9da3a850f608864c5cfa5dc13b498d29478530b73d2360b85cdb53d3"}],"candidate_id":"WEXP-SYNTH-CANDIDATE-A","counts":{"requirements":7,"vectors":7},"descriptor_version":1,"non_claims":["Synthetic migration fixture. Not a Publication Candidate, not a freeze, not a ceremony.","Carries no relationship to any real WEXP snapshot or published specification.","The authority block is a placeholder: published_specification is false, so these fixtures assert no published specification and carry no publication authority. snapshot_path names this seed itself, not a specification artifact."],"profile":{"path":"profile.json","sha256":"9839d4c22aad5b5b3321e0b6c9a509a7c1e2d2b728b3867fa041744b72a12f2b"},"release_status":"not-a-publication-candidate","status":"SYNTHETIC-MIGRATION-FIXTURE"}
