{
  "authority": {
    "published_specification": false,
    "snapshot_id": "WEXP-SYNTH-SNAPSHOT-B",
    "snapshot_path": "src/wexp_ref/core01/seeds/synthetic-b.json",
    "xml_bytes": 1,
    "xml_sha256": "000000000000000000000000000000000000000000000000000000000000000b"
  },
  "bound_files": [
    {
      "bytes": 2683,
      "kind": "test-vector",
      "path": "vectors/WEXP-SYNTH-B-TV-0001.json",
      "sha256": "4ee44e5eeb66b95dec8d34ca9857e2fbb9fe87de0a5313591879305985e407b4"
    },
    {
      "bytes": 2461,
      "kind": "test-vector",
      "path": "vectors/WEXP-SYNTH-B-TV-0002.json",
      "sha256": "532b2b9c8341bfca41fa5625dca6a104039661d3c616c01a53c1bd46a414e2a3"
    },
    {
      "bytes": 2458,
      "kind": "test-vector",
      "path": "vectors/WEXP-SYNTH-B-TV-0003.json",
      "sha256": "4ebdcfab4c3017067801e37617531167e9c3fea35b73b96cd940db12bf52ba38"
    },
    {
      "bytes": 2794,
      "kind": "test-vector",
      "path": "vectors/WEXP-SYNTH-B-TV-0004.json",
      "sha256": "43cb8e9abbf15fad5dc1219daf64da959ae3ec50dc62a0396054de5ccded13da"
    },
    {
      "bytes": 3038,
      "kind": "test-vector",
      "path": "vectors/WEXP-SYNTH-B-TV-0005.json",
      "sha256": "69989864f3b5df197f3f1d492e7a77fe4e1e710aa4b0715ade40b9d8d9138288"
    },
    {
      "bytes": 3031,
      "kind": "test-vector",
      "path": "vectors/WEXP-SYNTH-B-TV-0006.json",
      "sha256": "69111d527d205eba8a5c2ff3605294cdf5bc44ec9ccdd01feceb4524d69652a0"
    },
    {
      "bytes": 2074,
      "kind": "test-vector",
      "path": "vectors/WEXP-SYNTH-B-TV-0007.json",
      "sha256": "12633f36931848e14f243c5d153779d740dc0f6e8713519c8cadd010a4af38a3"
    }
  ],
  "candidate_id": "WEXP-SYNTH-CANDIDATE-B",
  "counts": {
    "requirements": 7,
    "vectors": 7
  },
  "descriptor_version": 1,
  "non_claims": [
    "Synthetic migration fixture. Not a Publication Candidate, not a freeze, not a ceremony.",
    "Carries no relationship to any real WEXP snapshot or published specification.",
    "The authority block is a placeholder: published_specification is false, so this fixture asserts no published specification and carries no publication authority. snapshot_path is not an operational locator."
  ],
  "profile": {
    "path": "profile.json",
    "sha256": "e6fc829bf1145dc69e944af8ca9991c8226ded24787e446a4179be0d42db1791"
  },
  "release_status": "not-a-publication-candidate",
  "status": "SYNTHETIC-SUCCESSOR-FIXTURE"
}
